{
  "apiVersion": "interfaces.takoform.com/v1alpha1",
  "kind": "InterfaceDefinition",
  "name": "edge.objects",
  "version": "1.0.0",
  "title": "Object bucket",
  "description": "Flat-namespace object storage with strong read-after-write consistency and STREAMING bodies. An object body never travels as a JSON member: maxObjectBytes is 5 GiB and no JSON string carries that, so get and put declare bodyStream and the bytes move as a stream beside the operation document. contentLength states the exact byte count in both directions, and a put whose stream does not deliver exactly contentLength bytes fails with invalid_body having stored nothing. Consistency: a get, head, or list issued after a put or a delete that has already resolved observes that put or that delete. Writes to one key are last-writer-wins; there is no cross-key atomicity, no transaction, and no versioning, so a replaced object is gone. An etag is a STRONG validator of the exact bytes of one object. A conditional get or put fences with ifMatch (act only when the current etag is exactly this one); a get may instead fence with ifNoneMatch on an etag, and a put with ifNoneMatch \"*\" to write only when the key is absent. A failed precondition is precondition_failed and changes nothing. A ranged get returns a contiguous subrange of ONE object: offset is the first byte, length the count, an omitted length runs to the end, and an offset at or past the object size fails with range_not_satisfiable rather than returning an empty body. Objects above maxSinglePutBytes, and any object whose size the producer does not know in advance, are written through the multipart operations: createMultipartUpload opens an upload, uploadPart writes one numbered part, completeMultipartUpload assembles the parts in part-number order into one object with one etag, and abortMultipartUpload discards the upload. At completion, every part except the highest-numbered part in that completion request MUST be at least 5242880 bytes, and every non-final part MUST have the same byte length; otherwise completion fails with invalid_part and assembles nothing. An upload holds no key until it completes, so a get of that key before completion behaves as though the upload did not exist. In a behavior trace, a step whose input declares bodyStream sends exactly contentLength bytes whose value at index i is i modulo 256, which makes every trace below byte-for-byte reproducible. Multipart traces are absent from that set because their steps depend on part etags the host mints during the trace; the executable Host/runtime conformance suite must measure the multipart obligations stated by this Interface.",
  "operations": [
    {
      "name": "head",
      "description": "Read one object's size, strong etag, content type, and write time without its body. Absent keys fail with not_found. uploadedAtMillis is milliseconds since the Unix epoch, in UTC, of the write that produced the current bytes.",
      "inputSchema": {
        "$schema": "https://json-schema.org/draft/2020-12/schema",
        "additionalProperties": false,
        "properties": {
          "key": {
            "maxLength": 979,
            "minLength": 1,
            "type": "string"
          }
        },
        "required": [
          "key"
        ],
        "type": "object"
      },
      "outputSchema": {
        "$schema": "https://json-schema.org/draft/2020-12/schema",
        "additionalProperties": false,
        "properties": {
          "contentType": {
            "maxLength": 256,
            "minLength": 1,
            "type": "string"
          },
          "etag": {
            "maxLength": 256,
            "minLength": 1,
            "type": "string"
          },
          "size": {
            "maximum": 5368709120,
            "minimum": 0,
            "type": "integer"
          },
          "uploadedAtMillis": {
            "minimum": 0,
            "type": "integer"
          }
        },
        "required": [
          "etag",
          "size"
        ],
        "type": "object"
      },
      "errors": [
        "invalid_key",
        "not_found",
        "backend_unavailable"
      ],
      "idempotent": true
    },
    {
      "name": "get",
      "description": "Read one object as a byte stream. bodyStream is always true in the output: the body is streamed beside this document and is never a member of it, so a caller may begin consuming before the whole object has arrived. size is the size of the WHOLE object, partial says whether a range was applied, and range echoes the exact subrange served. A conditional get fences with ifMatch (serve only when the current etag is exactly this one) or ifNoneMatch (serve only when it is not); a failed precondition is precondition_failed and carries no body. A range whose offset is at or past size fails with range_not_satisfiable.",
      "inputSchema": {
        "$schema": "https://json-schema.org/draft/2020-12/schema",
        "additionalProperties": false,
        "properties": {
          "ifMatch": {
            "maxLength": 256,
            "minLength": 1,
            "type": "string"
          },
          "ifNoneMatch": {
            "maxLength": 256,
            "minLength": 1,
            "type": "string"
          },
          "key": {
            "maxLength": 979,
            "minLength": 1,
            "type": "string"
          },
          "range": {
            "additionalProperties": false,
            "properties": {
              "length": {
                "maximum": 5368709120,
                "minimum": 1,
                "type": "integer"
              },
              "offset": {
                "maximum": 5368709120,
                "minimum": 0,
                "type": "integer"
              }
            },
            "required": [
              "offset"
            ],
            "type": "object"
          }
        },
        "required": [
          "key"
        ],
        "type": "object"
      },
      "outputSchema": {
        "$schema": "https://json-schema.org/draft/2020-12/schema",
        "additionalProperties": false,
        "properties": {
          "bodyStream": {
            "type": "boolean"
          },
          "contentType": {
            "maxLength": 256,
            "minLength": 1,
            "type": "string"
          },
          "etag": {
            "maxLength": 256,
            "minLength": 1,
            "type": "string"
          },
          "partial": {
            "type": "boolean"
          },
          "range": {
            "additionalProperties": false,
            "properties": {
              "length": {
                "maximum": 5368709120,
                "minimum": 1,
                "type": "integer"
              },
              "offset": {
                "maximum": 5368709120,
                "minimum": 0,
                "type": "integer"
              }
            },
            "required": [
              "offset"
            ],
            "type": "object"
          },
          "size": {
            "maximum": 5368709120,
            "minimum": 0,
            "type": "integer"
          }
        },
        "required": [
          "bodyStream",
          "etag",
          "partial",
          "size"
        ],
        "type": "object"
      },
      "errors": [
        "invalid_key",
        "not_found",
        "precondition_failed",
        "range_not_satisfiable",
        "backend_unavailable"
      ],
      "idempotent": true
    },
    {
      "name": "put",
      "description": "Write one object from a byte stream, replacing any previous object at the key, and return the strong etag of the bytes written. bodyStream MUST be true and contentLength MUST be the exact byte count of the stream; a stream delivering a different count fails with invalid_body and stores nothing. A conditional put fences with ifMatch on the current etag, or with ifNoneMatch \"*\" to write only when the key is absent; a failed precondition is precondition_failed and writes nothing. A contentLength above maxSinglePutBytes fails with value_too_large — that object belongs in a multipart upload.",
      "inputSchema": {
        "$schema": "https://json-schema.org/draft/2020-12/schema",
        "additionalProperties": false,
        "properties": {
          "bodyStream": {
            "type": "boolean"
          },
          "contentLength": {
            "maximum": 5368709120,
            "minimum": 0,
            "type": "integer"
          },
          "contentType": {
            "maxLength": 256,
            "minLength": 1,
            "type": "string"
          },
          "ifMatch": {
            "maxLength": 256,
            "minLength": 1,
            "type": "string"
          },
          "ifNoneMatch": {
            "enum": [
              "*"
            ],
            "type": "string"
          },
          "key": {
            "maxLength": 979,
            "minLength": 1,
            "type": "string"
          }
        },
        "required": [
          "bodyStream",
          "contentLength",
          "key"
        ],
        "type": "object"
      },
      "outputSchema": {
        "$schema": "https://json-schema.org/draft/2020-12/schema",
        "additionalProperties": false,
        "properties": {
          "etag": {
            "maxLength": 256,
            "minLength": 1,
            "type": "string"
          },
          "size": {
            "maximum": 5368709120,
            "minimum": 0,
            "type": "integer"
          }
        },
        "required": [
          "etag",
          "size"
        ],
        "type": "object"
      },
      "errors": [
        "invalid_key",
        "invalid_body",
        "value_too_large",
        "precondition_failed",
        "backend_unavailable"
      ]
    },
    {
      "name": "delete",